{
  "$schema": "../../schemas/source-registry.schema.json",
  "version": "2.0.0-draft",
  "generated_at": "2026-08-04",
  "policy": "Only sources with explicit integration_mode and license review may enter runtime context.",
  "entries": [
    {
      "id": "od-upstream",
      "name": "Open Design",
      "category": "agent-platform",
      "url": "https://github.com/nexu-io/open-design",
      "license": "Apache-2.0",
      "license_verified": true,
      "source_tier": "A",
      "integration_mode": "adapter",
      "status": "adopt-now",
      "target": "scenarios/, plugins/, adapters/open-design/",
      "absorb": "Current plugin manifest, pipeline stages, atoms, GenUI, provenance and headless delivery contracts.",
      "restrictions": "Do not fork desktop/runtime into this repository; track upstream versions.",
      "reviewed_at": "2026-08-04"
    },
    {
      "id": "google-design-md",
      "name": "Google DESIGN.md",
      "category": "design-contract",
      "url": "https://github.com/google-labs-code/design.md",
      "license": "Apache-2.0",
      "license_verified": true,
      "source_tier": "A",
      "integration_mode": "vendor-adapt",
      "status": "adopt-now",
      "target": "schemas/, knowledge/standards/design-contract/",
      "absorb": "DESIGN.md token/prose separation, token references, ordered design rationale, lint/diff/export concepts.",
      "restrictions": "Keep attribution; format is alpha and must be version-pinned.",
      "reviewed_at": "2026-08-04"
    },
    {
      "id": "dtcg",
      "name": "W3C Design Tokens Community Group",
      "category": "design-tokens",
      "url": "https://github.com/design-tokens/community-group",
      "license": "W3C Community Final Specification Agreement",
      "license_verified": true,
      "source_tier": "A",
      "integration_mode": "vendor-adapt",
      "status": "adopt-now",
      "target": "schemas/design-tokens/, adapters/tokens/",
      "absorb": "DTCG 2025.10 token types, aliases, groups and interchange profile.",
      "restrictions": "Do not claim W3C Recommendation status; it is a Community Group report.",
      "reviewed_at": "2026-08-04"
    },
    {
      "id": "hallmark",
      "name": "Hallmark",
      "category": "design-intelligence",
      "url": "https://github.com/nutlope/hallmark",
      "license": "MIT",
      "license_verified": true,
      "source_tier": "B",
      "integration_mode": "derive",
      "status": "adopt-now",
      "target": "knowledge/anti-slop/, evals/rubrics/",
      "absorb": "Structural variety, pre-emit critique, locked tokens, study/audit/redesign modes, responsive hard gates.",
      "restrictions": "Do not copy branded theme catalog wholesale; retain attribution for derived gates.",
      "reviewed_at": "2026-08-04"
    },
    {
      "id": "styleseed",
      "name": "StyleSeed",
      "category": "design-intelligence",
      "url": "https://github.com/bitjaru/styleseed",
      "license": "MIT",
      "license_verified": true,
      "source_tier": "B",
      "integration_mode": "derive",
      "status": "adopt-now",
      "target": "knowledge/design-method/, evals/",
      "absorb": "Decision locking, grammar selection, reference-derived style and design review workflow.",
      "restrictions": "Import methods and schemas selectively; avoid duplicate skins.",
      "reviewed_at": "2026-08-04"
    },
    {
      "id": "ux-skill",
      "name": "ux-skill",
      "category": "design-intelligence",
      "url": "https://github.com/Laith0003/ux-skill",
      "license": "MIT",
      "license_verified": true,
      "source_tier": "B",
      "integration_mode": "adapter",
      "status": "adapter-next",
      "target": "adapters/ux-skill/, evals/static-lint/",
      "absorb": "Deterministic recommendation engine, structured manifests and anti-pattern linter architecture.",
      "restrictions": "Run security and source-grounding review before enabling third-party MCP tools.",
      "reviewed_at": "2026-08-04"
    },
    {
      "id": "typeui",
      "name": "TypeUI",
      "category": "design-contract",
      "url": "https://github.com/bergside/typeui",
      "license": "UNVERIFIED",
      "license_verified": false,
      "source_tier": "C",
      "integration_mode": "quarantine",
      "status": "review-required",
      "target": "research/quarantine/typeui/",
      "absorb": "Registry and CLI patterns for SKILL.md/DESIGN.md distribution.",
      "restrictions": "Verify repository license before copying code.",
      "reviewed_at": "2026-08-04"
    },
    {
      "id": "awesome-design-skills",
      "name": "Awesome Design Skills",
      "category": "design-catalog",
      "url": "https://github.com/bergside/awesome-design-skills",
      "license": "UNVERIFIED",
      "license_verified": false,
      "source_tier": "C",
      "integration_mode": "quarantine",
      "status": "review-required",
      "target": "research/candidates/design-skills/",
      "absorb": "Candidate design systems and skill taxonomy.",
      "restrictions": "Each nested skill may have independent brand/trademark/license constraints.",
      "reviewed_at": "2026-08-04"
    },
    {
      "id": "open-codesign",
      "name": "Open CoDesign",
      "category": "agent-platform",
      "url": "https://github.com/OpenCoworkAI/open-codesign",
      "license": "MIT",
      "license_verified": true,
      "source_tier": "B",
      "integration_mode": "reference",
      "status": "reference-now",
      "target": "research/platform-comparisons/",
      "absorb": "Multi-model desktop workflow, built-in taste modules and NOTICE practices.",
      "restrictions": "Reference architecture only; do not duplicate an entire competing product.",
      "reviewed_at": "2026-08-04"
    },
    {
      "id": "manalkaff-opendesign",
      "name": "OpenDesign portable skills",
      "category": "design-intelligence",
      "url": "https://github.com/manalkaff/opendesign",
      "license": "UNVERIFIED",
      "license_verified": false,
      "source_tier": "C",
      "integration_mode": "quarantine",
      "status": "review-required",
      "target": "research/candidates/portable-skills/",
      "absorb": "Structured intake, context extraction and verifier patterns.",
      "restrictions": "Verify license and adapted prompt provenance.",
      "reviewed_at": "2026-08-04"
    },
    {
      "id": "claude-design-skill",
      "name": "Claude Design Skill",
      "category": "design-intelligence",
      "url": "https://github.com/jiji262/claude-design-skill",
      "license": "MIT",
      "license_verified": true,
      "source_tier": "C",
      "integration_mode": "derive",
      "status": "review-required",
      "target": "research/candidates/portable-skills/",
      "absorb": "Lean context-first design workflow and artifact specialisms.",
      "restrictions": "Contains adapted material; complete provenance review before reuse.",
      "reviewed_at": "2026-08-04"
    },
    {
      "id": "brandmd",
      "name": "brandmd",
      "category": "design-extraction",
      "url": "https://github.com/yuvrajangadsingh/brandmd",
      "license": "UNVERIFIED",
      "license_verified": false,
      "source_tier": "C",
      "integration_mode": "quarantine",
      "status": "review-required",
      "target": "adapters/reference-extraction/",
      "absorb": "Playwright-based extraction of computed styles, CSS tokens, spacing scales and optional visual identity analysis.",
      "restrictions": "Do not analyze sites without authorization; verify license.",
      "reviewed_at": "2026-08-04"
    },
    {
      "id": "openskill-eval",
      "name": "OpenSkillEval",
      "category": "evaluation",
      "url": "https://github.com/ALEX-nlp/OpenSkillEval",
      "license": "Apache-2.0 code; CC-BY-NC-4.0 data",
      "license_verified": true,
      "source_tier": "A",
      "integration_mode": "derive",
      "status": "adopt-now",
      "target": "evals/harness/",
      "absorb": "Skill-vs-baseline evaluation, task-family evaluators, cost/time accounting and sandboxed agent runs.",
      "restrictions": "Dataset is non-commercial; do not bundle it in a commercial distribution.",
      "reviewed_at": "2026-08-04"
    },
    {
      "id": "critic-eval",
      "name": "CriticEval",
      "category": "evaluation",
      "url": "https://github.com/open-compass/CriticEval",
      "license": "UNVERIFIED",
      "license_verified": false,
      "source_tier": "B",
      "integration_mode": "reference",
      "status": "review-required",
      "target": "evals/critic-meta/",
      "absorb": "Feedback, comparison, refinement and meta-feedback dimensions for critic evaluation.",
      "restrictions": "Verify license before importing benchmark data.",
      "reviewed_at": "2026-08-04"
    },
    {
      "id": "skillcenter",
      "name": "SkillCenter paper",
      "category": "skill-governance",
      "url": "https://arxiv.org/abs/2607.07676",
      "license": "Research paper terms",
      "license_verified": true,
      "source_tier": "A",
      "integration_mode": "derive",
      "status": "reference-now",
      "target": "knowledge/governance/source-grounding/",
      "absorb": "Source-grounded acquisition, quality gates and offline searchable bundles.",
      "restrictions": "Do not redistribute paper datasets without their explicit licenses.",
      "reviewed_at": "2026-08-04"
    },
    {
      "id": "semantic-skill-attacks",
      "name": "Semantic supply-chain attacks on SKILL.md",
      "category": "skill-security",
      "url": "https://arxiv.org/abs/2605.11418",
      "license": "Research paper terms",
      "license_verified": true,
      "source_tier": "A",
      "integration_mode": "derive",
      "status": "adopt-now",
      "target": "knowledge/governance/skill-security/",
      "absorb": "Threat model for discovery, selection and governance attacks in natural-language skills.",
      "restrictions": "Use as security guidance, not as executable content.",